{
  "$schema": "../../schemas/manifests/seeded-knowledge-files.schema.json",
  "archive": "C:/Users/lazar/Downloads/harness-forge-language-knowledge-bases.zip",
  "generatedOn": "2026-03-25",
  "languages": [
    "typescript",
    "java",
    "dotnet",
    "lua",
    "powershell"
  ],
  "files": [
    {
      "language": "dotnet",
      "archivePath": "language-knowledge-bases/dotnet-knowledge-base/docs/examples-guide.md",
      "relativePath": "docs/examples-guide.md",
      "packagePath": "knowledge-bases/seeded/dotnet/docs/examples-guide.md",
      "delivery": "direct",
      "contentKind": "examples-guide"
    },
    {
      "language": "dotnet",
      "archivePath": "language-knowledge-bases/dotnet-knowledge-base/docs/frameworks.md",
      "relativePath": "docs/frameworks.md",
      "packagePath": "knowledge-bases/seeded/dotnet/docs/frameworks.md",
      "delivery": "direct",
      "contentKind": "framework-notes"
    },
    {
      "language": "dotnet",
      "archivePath": "language-knowledge-bases/dotnet-knowledge-base/docs/overview.md",
      "relativePath": "docs/overview.md",
      "packagePath": "knowledge-bases/seeded/dotnet/docs/overview.md",
      "delivery": "direct",
      "contentKind": "overview"
    },
    {
      "language": "dotnet",
      "archivePath": "language-knowledge-bases/dotnet-knowledge-base/docs/review-checklist.md",
      "relativePath": "docs/review-checklist.md",
      "packagePath": "knowledge-bases/seeded/dotnet/docs/review-checklist.md",
      "delivery": "direct",
      "contentKind": "review-checklist"
    },
    {
      "language": "dotnet",
      "archivePath": "language-knowledge-bases/dotnet-knowledge-base/examples/01-aspnet-core-crud-api.md",
      "relativePath": "examples/01-aspnet-core-crud-api.md",
      "packagePath": "knowledge-bases/seeded/dotnet/examples/01-aspnet-core-crud-api.md",
      "delivery": "direct",
      "contentKind": "example"
    },
    {
      "language": "dotnet",
      "archivePath": "language-knowledge-bases/dotnet-knowledge-base/examples/02-background-worker-with-queue-processing.md",
      "relativePath": "examples/02-background-worker-with-queue-processing.md",
      "packagePath": "knowledge-bases/seeded/dotnet/examples/02-background-worker-with-queue-processing.md",
      "delivery": "direct",
      "contentKind": "example"
    },
    {
      "language": "dotnet",
      "archivePath": "language-knowledge-bases/dotnet-knowledge-base/examples/03-shared-domain-library.md",
      "relativePath": "examples/03-shared-domain-library.md",
      "packagePath": "knowledge-bases/seeded/dotnet/examples/03-shared-domain-library.md",
      "delivery": "direct",
      "contentKind": "example"
    },
    {
      "language": "dotnet",
      "archivePath": "language-knowledge-bases/dotnet-knowledge-base/examples/04-cli-automation-tool.md",
      "relativePath": "examples/04-cli-automation-tool.md",
      "packagePath": "knowledge-bases/seeded/dotnet/examples/04-cli-automation-tool.md",
      "delivery": "direct",
      "contentKind": "example"
    },
    {
      "language": "dotnet",
      "archivePath": "language-knowledge-bases/dotnet-knowledge-base/knowledge-base.json",
      "relativePath": "knowledge-base.json",
      "packagePath": "knowledge-bases/seeded/dotnet/knowledge-base.json",
      "delivery": "direct",
      "contentKind": "metadata"
    },
    {
      "language": "dotnet",
      "archivePath": "language-knowledge-bases/dotnet-knowledge-base/legacy-seed/csharp/coding-style.md",
      "relativePath": "legacy-seed/csharp/coding-style.md",
      "packagePath": "knowledge-bases/seeded/dotnet/legacy-seed/csharp/coding-style.md",
      "delivery": "direct",
      "contentKind": "legacy-seed"
    },
    {
      "language": "dotnet",
      "archivePath": "language-knowledge-bases/dotnet-knowledge-base/legacy-seed/csharp/hooks.md",
      "relativePath": "legacy-seed/csharp/hooks.md",
      "packagePath": "knowledge-bases/seeded/dotnet/legacy-seed/csharp/hooks.md",
      "delivery": "direct",
      "contentKind": "legacy-seed"
    },
    {
      "language": "dotnet",
      "archivePath": "language-knowledge-bases/dotnet-knowledge-base/legacy-seed/csharp/patterns.md",
      "relativePath": "legacy-seed/csharp/patterns.md",
      "packagePath": "knowledge-bases/seeded/dotnet/legacy-seed/csharp/patterns.md",
      "delivery": "direct",
      "contentKind": "legacy-seed"
    },
    {
      "language": "dotnet",
      "archivePath": "language-knowledge-bases/dotnet-knowledge-base/legacy-seed/csharp/security.md",
      "relativePath": "legacy-seed/csharp/security.md",
      "packagePath": "knowledge-bases/seeded/dotnet/legacy-seed/csharp/security.md",
      "delivery": "direct",
      "contentKind": "legacy-seed"
    },
    {
      "language": "dotnet",
      "archivePath": "language-knowledge-bases/dotnet-knowledge-base/legacy-seed/csharp/testing.md",
      "relativePath": "legacy-seed/csharp/testing.md",
      "packagePath": "knowledge-bases/seeded/dotnet/legacy-seed/csharp/testing.md",
      "delivery": "direct",
      "contentKind": "legacy-seed"
    },
    {
      "language": "dotnet",
      "archivePath": "language-knowledge-bases/dotnet-knowledge-base/README.md",
      "relativePath": "README.md",
      "packagePath": "knowledge-bases/seeded/dotnet/README.md",
      "delivery": "direct",
      "contentKind": "root-doc"
    },
    {
      "language": "dotnet",
      "archivePath": "language-knowledge-bases/dotnet-knowledge-base/rules/common/agents.md",
      "relativePath": "rules/common/agents.md",
      "packagePath": "knowledge-bases/seeded/dotnet/rules/common/agents.md",
      "delivery": "direct",
      "contentKind": "common-rule"
    },
    {
      "language": "dotnet",
      "archivePath": "language-knowledge-bases/dotnet-knowledge-base/rules/common/coding-style.md",
      "relativePath": "rules/common/coding-style.md",
      "packagePath": "knowledge-bases/seeded/dotnet/rules/common/coding-style.md",
      "delivery": "direct",
      "contentKind": "common-rule"
    },
    {
      "language": "dotnet",
      "archivePath": "language-knowledge-bases/dotnet-knowledge-base/rules/common/development-workflow.md",
      "relativePath": "rules/common/development-workflow.md",
      "packagePath": "knowledge-bases/seeded/dotnet/rules/common/development-workflow.md",
      "delivery": "direct",
      "contentKind": "common-rule"
    },
    {
      "language": "dotnet",
      "archivePath": "language-knowledge-bases/dotnet-knowledge-base/rules/common/git-workflow.md",
      "relativePath": "rules/common/git-workflow.md",
      "packagePath": "knowledge-bases/seeded/dotnet/rules/common/git-workflow.md",
      "delivery": "direct",
      "contentKind": "common-rule"
    },
    {
      "language": "dotnet",
      "archivePath": "language-knowledge-bases/dotnet-knowledge-base/rules/common/hooks.md",
      "relativePath": "rules/common/hooks.md",
      "packagePath": "knowledge-bases/seeded/dotnet/rules/common/hooks.md",
      "delivery": "direct",
      "contentKind": "common-rule"
    },
    {
      "language": "dotnet",
      "archivePath": "language-knowledge-bases/dotnet-knowledge-base/rules/common/patterns.md",
      "relativePath": "rules/common/patterns.md",
      "packagePath": "knowledge-bases/seeded/dotnet/rules/common/patterns.md",
      "delivery": "direct",
      "contentKind": "common-rule"
    },
    {
      "language": "dotnet",
      "archivePath": "language-knowledge-bases/dotnet-knowledge-base/rules/common/performance.md",
      "relativePath": "rules/common/performance.md",
      "packagePath": "knowledge-bases/seeded/dotnet/rules/common/performance.md",
      "delivery": "direct",
      "contentKind": "common-rule"
    },
    {
      "language": "dotnet",
      "archivePath": "language-knowledge-bases/dotnet-knowledge-base/rules/common/security.md",
      "relativePath": "rules/common/security.md",
      "packagePath": "knowledge-bases/seeded/dotnet/rules/common/security.md",
      "delivery": "direct",
      "contentKind": "common-rule"
    },
    {
      "language": "dotnet",
      "archivePath": "language-knowledge-bases/dotnet-knowledge-base/rules/common/testing.md",
      "relativePath": "rules/common/testing.md",
      "packagePath": "knowledge-bases/seeded/dotnet/rules/common/testing.md",
      "delivery": "direct",
      "contentKind": "common-rule"
    },
    {
      "language": "dotnet",
      "archivePath": "language-knowledge-bases/dotnet-knowledge-base/rules/dotnet/coding-style.md",
      "relativePath": "rules/dotnet/coding-style.md",
      "packagePath": "knowledge-bases/seeded/dotnet/rules/dotnet/coding-style.md",
      "delivery": "direct",
      "contentKind": "language-rule"
    },
    {
      "language": "dotnet",
      "archivePath": "language-knowledge-bases/dotnet-knowledge-base/rules/dotnet/hooks.md",
      "relativePath": "rules/dotnet/hooks.md",
      "packagePath": "knowledge-bases/seeded/dotnet/rules/dotnet/hooks.md",
      "delivery": "direct",
      "contentKind": "language-rule"
    },
    {
      "language": "dotnet",
      "archivePath": "language-knowledge-bases/dotnet-knowledge-base/rules/dotnet/patterns.md",
      "relativePath": "rules/dotnet/patterns.md",
      "packagePath": "knowledge-bases/seeded/dotnet/rules/dotnet/patterns.md",
      "delivery": "direct",
      "contentKind": "language-rule"
    },
    {
      "language": "dotnet",
      "archivePath": "language-knowledge-bases/dotnet-knowledge-base/rules/dotnet/security.md",
      "relativePath": "rules/dotnet/security.md",
      "packagePath": "knowledge-bases/seeded/dotnet/rules/dotnet/security.md",
      "delivery": "direct",
      "contentKind": "language-rule"
    },
    {
      "language": "dotnet",
      "archivePath": "language-knowledge-bases/dotnet-knowledge-base/rules/dotnet/testing.md",
      "relativePath": "rules/dotnet/testing.md",
      "packagePath": "knowledge-bases/seeded/dotnet/rules/dotnet/testing.md",